tags,texts
прогноз sup myspace блогосфера livejournal,"Безусловно, тайна SUP-а не раскрыта. Понятно, что ни для «улучшения» локализации ЖЖ, ни для создания местного отделения abuse-team, ни даже для поддержки более-менее рабочего ljplus.ru не нужны все эти прекрасные люди.

SUP создаёт шикарную, мощную техническую команду с грамотными людьми во главе (Комаров, Ишков). Они ищут программистов со знанием довольно редких вещей типа perlbal и MogileFS, на которых, тем не менее, держится современный livejournal.com. Они приглашают на работу авторов модулей с CPAN. Они привозят Фицпатрика — практически единоличного создателя LJ-движка — не на один день, а на целую неделю.

Одновременно они нанимают крайне занятого, но очень опытного Носика вкупе с энергичным и талантливым Засурским, которые, очевидно, могут и будут ставить перед этой командой соответствующие её уровню задачи.

Легко понять, что Полсона должны манить (как минимум, некоторые) лавры Мёрдока. Моё предположение: SUP будет делать русский MySpace, то есть напичканные спонсированной мультимедией и таргетированной рекламой блоги для самых широких масс. А объявленное партнёрство с СиксАпартом по ухаживанию за кириллическим ЖЖ носит второстепенный характер. В него миллионы долларов не вложишь."
joke шутка интернет Монголия развитие сеть интернет народов,"Здравствуйте! Сегодня мы начинаем трансляцию нового хабрапотока «Интернет народов мира». Волею судеб наш специальный хабра-корреспондент Педру Паоло Соуза Барбоза да Сильва оказался в великой стране Монголия, где по счастливой случайности ему удалось взять интервью у самого продвинутого интернет-пользователя в этой стране. 



Багатур Балагур — самый продвинутый интернет-пользователь Монголии.

П.П.С.Б. Да Сильва: Здравствуйте Багатур Балагур!
Багатур Балагур: Сайн байна уу! Педру Педру Паоло Соуза Барбоза да Сильва специальный корреспондент Хабрахабра.

П.П.С.Б. Да Сильва: Скажите Багатур Балагур, у вас такая великая страна Монголия! Наверно, в связи с этим у вас очень много интернет-провайдеров?

Багатур Балагур: Да, Монголия великая страна, с большими степями, долинами и горами, у нас много интернет-провайдеров, да.

П.П.С.Б. Да Сильва: Скажите Багатур Балагур, а как много у вас интернет-провайдеров?

Багатур Балагур: Монголия великая страна и у нас 18 интернет-провайдеров.

П.П.С.Б. Да Сильва: Скажите, Багатур Балагур! Если у вас такая великая страна и у вас так много интернет-провайдеров, наверно, у вас много интернет-пользователей?

Багатур Балагур: Да, Монголия великая страна и у нас много интернет-пользователей. У нас 23 тысячи интернет-пользователей, все они живут в разных городах и степях нашей необъятной родины, среди бескрайних равнин, гор и долин.

П.П.С.Б. Да Сильва: Скажите Багатур Балагур! А если у вас такая великая страна, в которой 18 интернет провайдеров, предоставляющих услуги доступа в интернет для 23 тысяч пользователей, то, наверно, у вас наверно много разных интересных сайтов, куда все эти пользователи ходят, разве не так?

Багатур Балагур: Да, Монголия великая страна, и у нас есть много разных интересных сайтов. У нас примерно 970 сайтов. Все они очень разные и интересные, именно на них ходят 23 тысячи интернет-пользователей нашей великой страны.

П.П.С.Б. Да Сильва: Скажите Багатур Балагур! Если у вас такая великая страна, в которой 18 интернет-провайдеров, предоставляющих услуги доступа в интернет для 23 тысяч пользователей, которые посещают примерно 970 сайтов и все они разные и интересные, у вас, наверно, есть поисковые машины, которые привлекают трафик на эти сайты?

Багатур Балагур: Да, Монголия великая страна и у нас есть поисковые машины, которые привлекают трафик на наши сайты, самая популярная поисковая машина в нашей великой стране — Google.

П.П.С.Б. Да Сильва: Скажите Багатур Балагур! Если у вас такая великая страна, в которой есть 18 интернет-провайдеров и поисковые машины для 23 тысяч пользователей, посещающих примерно 970 сайтов и все они разные и интересные, наверно, у вас есть электронная коммерция?

Багатур Балагур: Да, Монголия великая страна, у нас есть электронная коммерция и интернет-магазины, на которые ходят 23 тысячи интернет-пользователей нашей великой страны. Недавно мой родной дядя Дангаасїрэнгийн выменял на жеребца в нашем крупнейшем монгольском интернет-магазине Internom.mn книгу «Компьютерийн ухааны магистр». Совсем скоро в монголнете будет запущена первая платежная система «КиберТугрик», ее главное конкурентное преимущество — возможность конвертации КиберТугриков в КиберТенге.

.П.С.Б. Да Сильва: Скажите Багатур Балагур! Раз у вас такая великая страна и ваш интернет так быстро развивается, возможно ли, что скоро Монголия станет великой интернет-державой? Если это так, ожидаете ли вы приход компании «Яндекс» в Монголию?

Багатур Балагур: Да, Монголия великая страна, в этой стране живут люди — потомки Чингис и Кубилай ханов, поэтому мы станем еще и великой интернет-державой и, конечно же, когда станем великой интернет-державой, мы ожидаем приход компаний «Яндекс», «Яху» и «Янги», а также возможно ряда японскиx порталов.

П.П.С.Б. Да Сильва: Большое спасибо Багатур Балагур! И напоследок наш традиционный вопрос: Не могли бы дать читателям Хабрахабра 5 своих любимых монгольских ссылок.

Багатур Балагур: Конечно — бололгїй яахав.

5 ЛЮБИМЫХ ССЫЛОК Багатур Балагура — самого продвинутого интернет пользователя Монголии, специально для Хабрахабра:

1. www.google.com — самая популярная монгольская поисковая машина
2. www.internom.mn — самый популярный интернет-магазин Монголии
3. www.mol.mn — самый популярный каталог Монголии

* 3 ссылки, типа такой прикол

Специальный корреспондент Хабрахабра
Педру Паоло Соуза Барбоза да Сильва
из бескрайних интернет-просторов Монголии"
Хабрахабр,"Может быть, имеет смысл через какой-то период (например, 3 месяца) удалять сабж с сервера? Чтоб не засорялось… ))"
livejournal антон носик блогосфера суп яблоги,"Среди нововведений, которые появятся в ЖЖ в ближайшее время, станет отмена ограничения на 750 «френдов» и возможность поиска по комментариям в журналах. Об этом корреспонденту «Ленты.Ру» сообщил руководитель службы блогов компании «Суп» Антон Носик.

Напомним, по договору с компанией-владельцем ЖЖ Six Apart, «Суп» получает права на обслуживание и предоставление новых сервисов русскоязычным пользователям ЖЖ. Специалисты «Супа» располагают доступом к программному ядру LiveJournal и будут вносить в него изменения, которые затронут пишущих на русском языке блоггеров в ЖЖ как на территории России, так и за ее пределами. Одними из первых нововведений станет отмена квоты на количество друзей (крайне актуальная для отечественных пользователей ЖЖ, многие из которых достигли лимита в 750 «френдов») и предоставление поисковой службе «Yandex.Блоги» доступа к индексированию комментариев."
MacWorld Apple Стив Джобс Mac Кевин Смит iPhone iPod video i,"На выставке MacWorld '07 в Сан Франциско 8-12 января 2007 года можно будет:
1. Увидеть и услышать Стива Джобса с его keynote, скорее всего о iTV, может быть iPhone и как всегда еще что-нить, может и новый видео iPod полноэкранный с сенсорным дисплеем представит.
2. Поспрашивать о чем хотите Кевина Смита, создателя Джея и Молчаливого Боба и фильма «Клерки» и еще много каких хороших, большого любителя Маков.
3. Посетить презентацию «Фотография и цифровые технологии», которую будет вести фотограф и писатель Джоэл Мейеровиц.
И много чего еще. Никто туда не собирается, а?"
комментарии банеры хабрареклама,"Как вам такая идея — снабдить рекламные банеры возможностью комментирования? Если движок свой, вполне можно реализовать. 

Просто иногда хочется чего-то спросить у других хабровцев, среди которых, кстати, можно встретить и непосредственных рекламодателей. Поспорить о чем-то. Поделиться мнением. Это может быть интересно.

Опять же, получится мини-эксперимент по новым формам рекламы, который в случае успеха войдет в анналы."
вебальта хабрахабр webalta,Вебальта задумала сделать большой-большой Хабрахабр!
Rambler Media topshop топшоп глюки раздолбайство,"ТопШопом никто на Рамблере похоже давно не занимается.
Наши менеджеры 2 месяца безрезультатно пытались добиться от них счета за невидимый счетчик, их посылали к Генеральному Директору ООО «Рамблер Интернет Холдинг» — типа только он может решать такие вопросы :)

А пару дней назад пришло письмо:

Внимание! Участие Вашего ресурса в рейтинге Rambler's TopShop приостановлено!
Возможно, это связано с тем, что Ваш ресурс недоступен, или HTML-код счетчика удален со страницы Вашего ресурса.
У нас, естественно, все было в порядке.

Давно ходили слухи о том, что Рамблер собирается прикрыть этот проект, поскольку он не приносит доходов.
И вот, похоже, они его сворачивают, только как-то уж очень некрасиво.

А может быть это все просто глюки и раздолбайство? :)"
баннер плагиат Готовцев РА Маньяко КМФР фестиваль,"тем временем Связной активно рекламируется баннером изрядно спизженным с нашего баннера — серебрянного призера КМФР

то есть вчера там просто был напоминающий баннер, сегодня уже чисто скретч и надписью сотри меня
ща для истории сохраню себе

ну

поздравляю нетпро с тщательно освоенным бюджетом на «креатифф»"
YouTube япония видео авторские права,"Популярному видеоресурсу YouTube пришлось удалить 29549 видеоклипов по требованию японской медиа-корпорации, заявившей о нарушении авторских прав, сообщила Организация по защите авторских прав в Токио агентству Reuters.

Инициативная группа, представляющая 23 японские организации, в том числе телевизионные сети и кинокомпании, обратилась к YouTube с требованием принять меры для того, чтобы блокировать незаконно распространяемые файлы. Представители японской группы в официальном заявлении напомнили интернет-пользователям о том, что они нарушают закон, выкладывая в общем доступе файлы, защищенные авторским правом.

По данным Reuters, многие владельцы авторских прав жалуются, что YouTube отказывается отслеживать правомерность поступления файлов, поскольку работает с более чем 100 миллионами видеофайлов в день. Представители YouTube пока никак не прокомментировали инцидент"
работа monstercom hhru superjobru,"Крупнейший в мире ресурс для поиска работы открыл сайт MonsterRussia.ru. Можно видеть тысячи вакансий, скопированных с hh.ru, superjob.ru и других сайтов. 
Работодателям предлагается воспользоваться платными услугами по ценам от 1250 руб.
Выручка Monster Worldwide, Inc. в 2005 году составила почти миллиард долларов, а прибыль — 107 миллионов. Причём, если верить годовому отчёту, бОльшую часть выручки (70%) Monster зарабатывает в США, а вот инвестировать предпочитает за рубежом.
Можно ожидать, что кого-то из владельцев российских job-проектов ждут приятные расставания со своими активами."
СУП dolboeb SUP-Fabrik,"Мне кажется, человек слишком политизированный, открыто ненавидящий страну, в которой живет, провоцирующий определенный тип людей атрибутами веры, призывами и слоганами на картинках, не имеет права называть ублюдками пользователей сервиса, который он недавно возглавил. Просто потому что для других людей он тоже может быть ублюдком, в силу разных причин. Так устроен мир и люди. Оскорблять других публично, в то время когда они являются клиентами сервиса, который ты возглавил – самое последнее дело. После этого обычно увольняют. Или перестают замечать."
работа,"«Independent Media Sanoma Magazines» в данном случае нужно понимать как «газета Ведомости». С полным текстом вакансии можно ознакомиться на сайте «Ведомостей».
С кандидатами беседует Наталья Моисеенкова, ранее известная нам по проекту E-xecutive.
Позвонив в «Ведомости» по телефону 232-3200 удалось побеседовать с ней в качестве кандидата.
Удалось выяснить, что Independent Media (или сами Ведомости) планируют создать сайт для «бизнес аудитории». Расчётная посещаемость — около 400 тысяч уников в сутки. Соответственно, приветствуются кандидаты, имеющие опыт создания подобных веб приложений. За кандидатом оставляют право выбора платформы, что есть хорошо. Зарплату не озвучивают, что есть плохо."
комменты голосование хабрахабр минус,"Почему выбрали длииииииинный минус (или дефис) ""—"", почему там не знак минуса?
Просто мне в глаза бросаеться — плюсик такой маленький, зелененький, приятный, а минус огромный, страшный — я аж боюсь когда вижу около коммента такой кровавый, большой минус, тоесть дефис."
Google блогосфера,"

Google запустил официальный блог на польском языке."
Microsoft Charles P Thacker разработка процессоры Xbox,"Microsoft открыла свою собственную команду по разработке компьютерной архитектуры (Computer Architecture Group), которую возглавляет Charles P. Thacker.

Лаборатории будут расположены как в штаб-квартире компании в Редмонде, так и в Силиконовой долине.

По словам инженера Microsoft, Чарльза Такера, одной из причин заинтересованности компании в разработке собственных процессоров являются планы на будущее игровой консоли Xbox. Возможно, разработкой процессора для неё будет заниматься как раз свежеоткрытая команда. Но это не единственная причина. Компания будет развивать технологии распознавания голоса, которые тоже будут обкатываться в этих лабораториях.

Источник новости: The New York Times"
комментарии уведомления,"В поле From: или хотя бы в теме письма с уведомлением стоит писать, от кого данный комментарий/сообщение и на какую тему.

Когда их за ночь приходит десяток, хочется читать в осознанном порядке."
комментарии юзабилити,"Появилась буквально-таки коллективная мысль. Излагаю. Есть ли возможность сделать возможность редактирования своих комментариев для сокрытия страшных грамматических ошибок и опечаток?
Конечно же до первого ответа, после – уже никак. Было бы просто замечательно, думаю."
Великобритания отпечатки пальцев алкоголь,"В Великобритании решили снимать отпечатки пальцев у посетителей пабов и клубов во всех более-менее больших городах. В одном из городов провели испытание новой системы в течение 8 месяцев и обнаружили падение количества преступлений, связанных с алкоголем, на 48%. Общественность на Slashdot сомневается в том, откуда могли взяться 48%, но местные власти, якобы, настроены решительно. Кажется, они сошли с ума."
хабрахабр ошибки,"Нашел небольшую очепятку в хелпе.

Друзья пользователей разнесены по трем кругам. В первом состоят друзья пользователя, во втором — друзья друзей пользователя, в третьем — друзья друзей пользователя.

Явно с третьим кругом что-то не то."
НЛО,"А вот и я!

Я прилетело купить Google и Абрамовича, забрать Воложа из Яндекса, Яндекса из Воложа, сварить суп из Носика и уволить из российского офиса Гугла всех менеджеров Рамблера. Даешь каждому возможность создавать опросы, писать глупости и покупать карму за WebMoney!

Я всё сказало!"
