tags,texts
Google автозамена,"Прикольный вариант замены Гугль предлагает по запросу «довоевался».
Наверное, там работают добрые пацифисты. :)"
Бегун мотороллер реклама,"

Очень улыбнуло)))"
google master plan humor,"Главная схема Google с доски в холле, которую стерли 2 месяца назад. Крис ДиБона (Chris diBona) прокомментировал: «Это было похоже на что-то коварное». Смесь серьезных схем и гиковского юмора дает много понять о культуре Google. От найма инженера-разработчика до перепроектирования протоколов TCP/IP и HTTP, от космического лифта до покупки AOL, от Google OS до Noosphere, и наконец до спасения мира.
Вы можете посмотреть серию фотографий Главной Схемы Google (на данный момент стертой) снятых Крисом ДиБона здесь. Так же доступно панорамное фото высокого разрешения на Undergoogle.com.
Источник

P.S.
Заранее прошу прощенья за возможно немного угловатый перевод."
контекстная реклама Директ Бегун Адсенс Хабрахабр авторы отч,"Поскольку о выплатах хабралюдям написали сразу несколько топиков, спешу сообщить: с «Бегуном» уже достигнута договоренность о механизме отчислений авторам через эту систему, больше того, такой механизм уже готов со стороны «Бегуна» (его можно включить прямо сейчас), но не готов с нашей, поскольку droganov прямо сегодня изменил первоначальный план — в комментариях к топику о выплатах он написал, что гугловский Адсенс тоже можно использовать для отчислений, — над этим будем работать прямо с сегодняшнего дня. Еще интересует, возможна ли такая схема с Директом? Чтобы зарегистрированные пользователи могли вставлять в свои страницы на сайте код яндексоидов, для широты выбора. Таким образом, авторы смогут вставлять в свой контент или Бегун (что уже решено), или Адсенс (что решаемо), или Директ (что пока непонятно). Как больше нравится. Заодно соберем статистику о том, какая контекстная система лучше всего подходит для сообществ (и выплат авторам сообществ)."
Left  Dead игры valve cs counter-strike игровая индустрия,"Как-то обошли мы вниманием тот факт, что Valve и команда девелоперов Turtle Rock Studios официально анонсировали экшн Left 4 Dead, который будет базироваться на последнем воплощении движка Source Engine и включит в себя вторую версию AI-технологии Turtle.

Выход Left 4 Dead намечен на 2007-й год, тогда же и станет ясно, станет ли эта игра преемником легендарного Counter-Strike!"
Мась уапортал убс,"На днях Алексей Мась продал принадлежащие ему доли в «Украинском Портале» и «Украинской баннерной сети». Судя по личному блогу Алексея он готовит пресс-конференцию. Покупателем стал украинский инвестор, который уже владеет несколькими украинскими интернет компаниями. Фамилию покупателя и сумму сделки я не разглашаю, думаю Алексей сам сообщит это, если захочет. Но как по мне, сумма получилась заниженная для двух проектов, которые хоть и старые и отсталые, но имеют большую базу пользователей, которую можно было бы умело направить в нужное русло.

В рассылке вебмена он уже начал искать новых разработчиков большого проекта, видимо начал вкладывать полученные деньги :)"
Adobe Flash Kuler цвет колористика,"Интересное приложение из недр Adobe Labs. Позволяет создавать цветовые палитры и обмениваться ими, а так же умеет работать с файлами Adobe Swatch Exchange (.ASE). Для работы с кулером (по-русски, наверное лучше сказать колером) необходим Flash Player 9.0.28.0. Однако, для того чтобы не просто «поиграть» с приложением, а начать его реально использовать, необходимо зарегистрироваться на сайте Эдоби."
Wordpress плагин шифрование,"Любопытный и в целом полезный плагин для WP — Subrosa – Contact Form Encryption. Позволяет отправляющему сообщение через контактную форму зашифровать текст, сделав передачу данных более безопасной.

Описание, скачать"
Google комиксы Марисса Мэйер Сергей Брин Эрик Шмидт Ларри Пэ,"Уже и комиксы… ) В главных ролях — Брин и компания.
Под хабракатом — картинка на 100 кб. 


Англ.версия"
iphone apple слухи,"Средства массовой информации разобрали iPhone буквально «по косточкам». Стало известно, что будут выпущены две модели телефона, общественность почти определилась с компаниями, которые будут поставлять комплектующие для новинки. Кроме того, дано общее описание iPhone и даже представлены его внешний вид и спецификация.




Теперь поступило сообщение о том, что новинка будет поддерживать беспроводную связь WI-FI. Информация же, свидетельствующая о доступности iPhone в версиях для сетей GSM и 3G, является косвенным подтверждением слухов того, что телефоны Apple будут доступны в розничной сети.

Дело в том, что сети GSM получили наибольшее распространение в Европе, а 3G — в Соединенных Штатах. Выпуск GSM-версии может означать ориентацию на европейский рынок. Спрогнозировать планы Apple — задача не из простых. Ведь компания уже не раз за свою историю доказывала, что умеет ломать стереотипы."
mp музыка авторское право закон право mpsearchru allofmp,"Поводом открыть блог «Музыка» первым постом стала запись о продаже MP3Search якобы в связи с поправкой в законе об авторском праве.

Напомню, что 1 сентября 2006 года в закон «ОБ АВТОРСКОМ ПРАВЕ И СМЕЖНЫХ ПРАВАХ» были внесены изменения, в соответствие с которыми «автор получает исключительные права на то, чтобы осуществлять или разрешать сообщать произведение таким образом, при котором любое лицо может иметь доступ к нему в интерактивном режиме из любого места и в любое время по своему выбору».

Всё бы хорошо, но по онлайн-СМИ прокатилась серьёзная волна сообщений о том, что пришёл конец многочисленным mp3-шопам, да и была высказана заинтересованность в том, как выкрутятся из сложившейся ситуации такие гиганты, как allofmp3.com, mp3search.ru, delit.net.

Поправка вызвала резонанс, но кто от неё выиграл?
А выиграли от неё практически все.

Выиграли владельцы сайтов-гигантов, избавившись от мелких, но отъедающих свои кусочки паразитов — негигантских mp3 сайтов.
Выиграли владельцы не очень больших mp3-сайтов, которые не вынашивали никаких планов по дальнейшему развитию своих сайтов, получая потихоньку вои крохи. Они просто дорого продали свои порталы более безбашенным либо менее осведомлённым в правовом плане интернетчикам.
Выиграли даже авторы, которые получили ещё одну возможность бороться за свои права, пускай и немного призрачную в реалиях рунет-аудиобизнеса.

Кто проиграл? Трудно сказать. Возможно, «кэшеры» вроде РОМС и ФАИР, ведь им теперь придётся чуть больше работать в связи с обострением у авторов :)

Если на Хабре есть владельцы музыкальных сайтов, поделитесь, пожалуйста, своим мнением — как поправка коснулась вас и коснулась ли вообще?"
Zune iPod Apple Microsoft Amazoncom Creative Sandisk mp пл,"Плеер Zune, которому предрекали будущее «убийцы iPod» стремительно отстает не только от своего главного конкурента, но и от mp3-плееров других производителей.

В Топ-10 продаж техники Amazon.com Zune держался всего несколько дней после запуска. Сейчас* в сотне лучших продаж представлена лишь одна модель Zune (30Гб, черный цвет, 92 место). В это время различные модели iPod занимают 6 мест в Топ-10, Sansa M240 от Sandisk расположился на 7 и 16 местах, а Zen Vision:M от Creative — на 21.

Ближайшее будущее Zune выглядит еще более грустным. Эксперты прогнозируют, что во время рождественских распродаж будет куплено около 15 млн. плееров от Apple, тогда как Microsoft может рассчитывать лишь на 300-500 тыс.

Обозреватели связывают такое положение дел с резко негативными откликами в прессе про детище Microsoft. Но это не огорчает разработчиков. В интервью Wall Street Journal представитель корпорации поведал, что всё в точности соответствует их ожиданиям.

* По состоянию на 28.11.06 21:00 Мск

Источник: BetaNews.com"
AllofMPcom копирайт,"На digg.com сегодня появилась ссылка на официальное соглашение между США и Россией, в котором было сказано, что Россия согласна закрыть allofmp3.com и все сайты, которые «позволяют нелегальное распространение музыки и других закопирайченных работ».

Соглашение было подписано 19 ноября и было вывешено на сайте Торгового Представительства США (оригинал)."
Хабрахабр рекомендации,"Сегодня ночью в разделе «Компании», в подменю, появилась новая ссылка — «Рекомендации». Мы решили транслировать по 10 штук на этой странице; на странице рекомендации — весь список сразу.
Рядом с названием рекомендации транслируется кол-во пользователей, рекомендующих этот объект в окружающем пространстве. Тоже самое — в профиле пользователей, рекомендующих объекты.

Хабрахабр!"
Google,"на Яндексе вы такого точно не увидите ..;-)

без комментариев…

"
opera opera mini release опера опера мини анонс,"Как сообщает Opera Software в пресс-релизе, вышла Opera Mini 3.0!

Новые функции появились следующие:

Публикация фотографий: отправка на email, в форум или блог
RSS: теперь ленты новостей можно смотреть прямо из Opera Mini
Безопасные подключения: теперь поддерживается шифрование
Группировка контента: оптимизирована работа с меню и страницами

Доступна свежая версия как всегда здесь."
Apple Xmas афоризмы,"В период предрождественских продаж продавцам в Apple store выдают красные футболки. Сзади на футболках написаны различные слоганы. 

Вот какие в этом году:
* «Give now. Borrow later» 
* «Give movies, give music, give TV shows»
* «They asked for something colorful. They didn’t mean a sweater „
* “For a PC user it’s not a gift. It’s an intervention»
* «Looking for something they’ll actually wear?»
* «This could be the end of regifting. And rebooting.»
Подсмотрели это ребята с ifoAppleStore
Варианты переводов в комментах"
google yahoo google answers yahoo answers конкуренция,"Сегодня Google потерпел первое публичное поражение в конкурентной борьбе. Один из старейших сервисов поискового гиганта Google Answers закрывается! С сегодняшнего дня прекращается прием новых вопросов, а последние ответы на ранее поступившие появятся до конца этого года.

Эксперты называют разные причины закрытия сервиса, но очевидно одно — политика Google Answers оказалась менее удачной, чем у Yahoo Answers. Главное отличие между этими сервисами заключалось в деньгах — задавать вопросы и получать на них ответы в Yahoo Answers можно совершенно бесплатно, тогда как Google Answers требовал оплаты за ответы, однако были и выплаты отвечавшим.

Вот что пишет один из авторитетных блоггеров:
«Проблема заключается в том, что люди не хотят платить каким-то экспертам за подробный ответ, им нужен простой ответ человека с улицы. У людей нет времени на чтение книг, газет с множеством страниц и длинных статей, но они с восторгом смотрят реалити-шоу. Вам больше нравится слушать таких же невежественных людей, как и вы»."
Google Spreadsheets,"С сегодняшнего дня можно публиковать в сети любой документ созданный в Google Spreadsheets. Выбор формата остается за вами – HTML, PDF, XLS, ODS, CSV, или даже в виде фида – в любом случае файл будет обновляться автоматически.
Но самым интересным нововведением стала возможность внедрения таблиц на страницы сайтов и блогов в виде модуля, в котором отображаются выбранные вами листы документа, а так же его предыдущие ревизии.

Подробнее →"
microformats микроформаты rel-tag таги LiveJournal Textpatte,"Микроформат rel-tag используют в качестве формата для разметки тагов такие сайты, как LiveJournal, ODEO, Eventful, однако и простые смертные могут легко создавать такого рода контент у себя, используя следующий инструментарий:



Для движка Textpattern:

pnh_mf
tru_tags
 
Для движка Wordpress:

Bunny’s Technorati Tags
Simpletags


Поиск по тагам

Эту задачу решает особый сервис сайта Technorati: www.technorati.com/ping

"
Windows,"Меню «Пуск» -> «Выполнить» -> eudcedit

«Редактор личных символов». Любопытная программка, которая позволяет создавать и редактировать специальные символы, встраивая их в винду.

Нашёл на digg."
HTML теги хабрахабр предложение,"Мне кажется, было бы логично разрешить для использования в комментариях и текстах следующие HTML теги:
<acronym> — для удобной расшифровки сокращений, которые в великом множестве присутствуют в IT текстах
<big>, <small> — родные, но почему-то обделённые братья разрешённых смысловых тегов <em> и <strong>
<sup> и <sub> — могут пригодиться для сносок, примечаний, записи химических и прочих формул
"
robotstxt поиск поисковые боты Microsoft Live,"Microsoft сообщает, что имена поисковых ботов Live остаётся прежним — MSNBot.

MSNBot — Main web crawler (www.live.com)
MSNBot-Media — Images & all other media (images.live.com)
MSNBot-NewsBlogs — News and blogs (search.live.com/news)
MSNBot-Products — Products & shopping (products.live.com)
MSNBot-Academic — Academic search (academic.live.com)

Host name для них всегда оканчивается на search.live.com (например, livebot-207-46-98-149.search.live.com)."
Google комиксы поисковый спам,"Под хабракатом — очередной комикс. Примерно 80 кб.



Английская версия

Продолжение — сегодня ближе к вечеру."
Apple podcast лицензия Стив Джобс,"Подкастеры из австралийского Global Geek Podcast, боясь лицензирования слова Podcast, решили сами принять меры и первыми написали Стиву Джобсу, приложив чек на 1 доллар: «Мы бедные подкастеры, ничего за душой нет, вот все что есть.» Ответ пришел, но не от Джобса, а из отдела защиты торговой марки Apple: 
""… Мы возвращаем ваш чек на сумму один доллар. Apple не возражает против использования третьими лицами общеупотребительного термина «подкаcт» в случае, если речь идет непосредственно о подкастинге. Компания не собирается лицензировать данный термин"".
Под хабракатом скан письма.
 "
blogru клоуны так делать не надо Егор Воронов,"Урал подарил рунету таких замечательных людей, как Роман Иванов или, скажем Кирилл Иванский. Но, к сожалению, не все люди на урале стремятся к развитию, созданию интересных уникальных проектов и способны уважать оппонента.

Представляю вашему вниманию порцию информации из разряда вредных советов, да и просто клоунаду под громким названием ""помощь коллегам по цеху"" (зеркало).

Можно описать это коротко — «Боже, что они сделали с бизнес-линчем?!» или просто выматериться.

Выражаю искреннее сочувствие ребятам из ""Медиасайта"", которые в отличие от клоунов, делают отличные проекты на уровне рунета."
кросспотинг,Сегодня писал «Текст» про Яндекс. Свои мысли и наблюдения. Текст был тематичен не только тегу «Яндекс» но и Блогу «Яндекс». Было бы очень удобно добавить возможность попадать и туда. т.е. какойто вид кросспостинга. спасибо.
сноуборд,"Привет =) давайте знакомится =)!

пора не только работать но и отдыхать. среди моих боевых товарищей в сфере IT многие любят покататься на сноуборде. Думаю и многим из вас это будет интересно.

или смерть ?"
НЛО мозг поднимите мне карму быстро я сказало!,"А то всех забиру и мозг высосу! Шутка.

Это сообщение не является угрозой, соглашением о намерениях или агитацией на Выборах-2008."
сноуборд блог,"привет, кто нибудь любит сноуборд? я зарегистрировал блог что бы делится всей свежей информацией с вами!

www.habrahabr.ru/blog/snowboard"
карма хабрахабр,"Хочу знать, кто мне повысил/понизил карму."
