tags,texts
датацентр colocation dedication пресс-релиз,"Компания Филанко, проект DataHouse.su, объявляет о запуске нового центра хранения и обработки информации.

Работы по проектированию и пусконаладке оборудования, обеспечивающие функционирование нового центра, в настоящий момент полностью завершены, и центр готов принять всех желающих разместить свои сервера или арендовать выделенные сервера необходимой конфигурации на новой площадке.
При построении Центра значительное внимание было уделено созданию решений, обеспечивающих максимальную доступность и безопасность систем, расположенных на этой площадке. Специалисты компании разработали ряд подсистем, позволяющих решить основные задачи, стоящие перед пользователями вычислительных центров:

• Бесперебойное питание. Обеспечивается двумя независимыми вводами от двух различных секций подстанции, а совместно с использованием источников бесперебойного питания компании позволяет предоставлять надежное энергообеспечение. Возможность потребления суммарной мощности до 1 МВт и архитектура внутреннего энергообеспечения ЦОД позволяют предоставить электропитание до 10 КВт на стойку.
• Охлаждение гермозоны. С ростом энергопотребления серверов, усложняются задачи по отводу тепла. Общее решение по охлаждению гермозоны построено по принципу горячей/холодной зоны и наращивается по мере увеличения выделения тепла. Решения по охлаждению реализованы на базе Mitshubishi.

• Пожаротушение. Новый центр обработки данных компании Филанко DataHouse.su оборудован всеми необходимыми системами газового пожаротушения согласно ГОСТ 12.1.004-76.ССБТ. Системы включают в себя пожарную сигнализацию, состоящую из расположенных по периметру помещения датчиков возгорания и систему газового пожаротушения. Газ, использующийся в системе, безвреден для оборудования.

• Обеспечение физической безопасности. Доступ в гермозону строго регламентирован. Контроль доступа обеспечивается системой аутентификации. На территории комплекса установлена система видеонаблюдения, позволяющая службе безопасности осуществлять контроль в режиме реального времени.

• Доступность каналов связи и информационная безопасность.
Связанность ЦОД обеспечивается проектом CityTelecom.ru, имеющим собственную ВОЛС в Москве. Функционирование сети обеспечивается активным оборудованием компании Cisco Systems. Безопасность информации клиентов является важнейшим приоритетом для DataHouse.su, поэтому по требованию заказчика может быть обеспечено резервное копирование информации, фильтрация трафика и системное администрирование выделенных серверов.

Таким образом, компания Филанко разработала инфраструктуру и регламент, гарантирующие заказчикам доступность серверов и безопасность их данных. Разумеется, от форс-мажорных не застрахован никто, но опыт специалистов компании и ее инвестиции в построение стабильного решения обеспечат выполнение самых строгих бизнес-требований клиента.

Источник — www.DataHouse.su"
nooface интерфес человеко-машинный интерфейс устройства ввод,"http://nooface.org/. 

Сайт на английском.

Если судить по коментариям, то аудитрия у него не большая. Тем не менее все новинки касательно интерфейсов там проскакивают. Это и разный альтернативные способы управления — перчатки, камеры отслеживающие движения, наклоны устройства, и варианты предтсавления информации в 2D и 3D, и веяния в web 2.0 и размышления о типах GUI для определенных устройств (мобильных, настольных, для детей) и виртуальные миры типа SeconfLife."
рекомендации форвард пересылка привлечение внимания,"Само собой понятно что не все друзья читают то же что и ты.
Также понятно что если кто-то добавляется в друзья, то значит мнение этого человека не безразлично.

А не объеденить ли это вместе? Создать такой метод привлечения внимания к интересным (по мнению ваших друзей) топикам.

Т.е рядом с кнопкой «в избранное» кнопку «закинуть друзьям».

Ну а дальше уже детали оформления. Как представить такой список рекомендаций на стороне получателя. Вводить или нет возможность коментариев для друзей (чтобы знали что привлекло ваше внимание в посте — типа «смотри всемирный заговор, аффтаж жжет» ;). Рассылать только первому кругу или всем, но с каким-то угасанием. Вводить возможность выбирать от кого что получать или же даже рейтинговать (чтобы пришедшее через 3и руки угасало постепенно). Делать ли группы друзей для таких рекомендаций (этим — шлем приколы, этим — умняки, этим — места где пофлеймить можно. ;) Или же анонсить такие группы среди друзей, а те пусть выбирают в какие подписаться (и с каким default уровнем рейтинга, если он будет, получать сообщения из этой группы).

Получится аналог того что происходит сейчас в icq и почте, когда все новое и прикольное рассылается по личным спискам рассылки.

Кто что думает? Пригодится такое? :)"
яндекс хабрахабр блоги,"Есть ли на Хабре блоги? 
Пишут ли в них посты? 
Почему тогда площадка не отображается здесь: blogs.yandex.ru/services?

Вопрос в первую очередь представителям Яндекса."
apple iphone cisco engadget,"Brian Lam сказал чистую правду, iPhone в самом деле был анонсирован в понедельник, 18 декабря. Но анонсировала его не Apple, а Cisco.
Соответственно, и характеристики выпущенного телефона не имеют ничего общего с ожидаемыми: iPhone является просто VoIP-трубкой к Skype.
Тем же, кто ждал телефона от Apple, остаётся гадать, как он будет называться, если появится вообще.
[ оригинальный пост на engadget.com ]"
программирование ошибки пользователи советы,"Вот пишите вы, допустим, какой-то софт. Не то чтобы для себя пишете, а так — для коллег или для фирмы. А может и на продажу. Только пока вы делаете это один — сам себе и швец, и жнец — т.е на звонки пользователей тоже отвечать приходится. То это не работает, то это… 

«Ошибки», что пользователи видят — сам же в программу и запихиваешь — сообщения т.е. :) не сами ошибки. Вот знаешь что если закончилось место, то надо тут же сообщить пользователю (из доброты душевной) — «нет места!». А потом вдруг звонит тебе кто-то со словами «мне тут оно что-то написало, но я не читал — вообщем ничего не работает!». Думаешь — неужели не могут запомнить что написало?

Лааадно — вставляем туда число «12312 Нет места!» — и всем говоришь — запысывайте номер.

Ну снова звонок — ситуаия лучше, но всеравно играем в догадки что с ним такое случилось…

При этом всем не всегда даже знаешь что может произойти и появляются сообщения вроде «Ошибка! виг знает какая, но переменная Х почему-то не 5!» — что вообщем кажется логичным пока ты это в программу вписываешь, но совершенно выводит из себя, когда это тебе по телефону зачитывают (ну можно конечно диалог сделать таким, чтобы еще иконка была «скопировать ошибку в клипбоард» или там просто выделить текст, только никто не делает).

Так вот к чему все — очень полезно (для своих нервов) делать проги так, чтобы функция вывода сообщения об ошибке была одна. При этом через нее можно было задать 2 сообщения — для человека (понятное) и для себя (подробное). Да еще и уровень debug-ности — что писать, что нет и в какой лог. Далее писать не только ошибки, но и события (открыли файл, закрыли, что-то нажали).

Теперь если случается что-то не то — просто просишь прислать лог и все сразу ясно. :)

На период внедрения ПО — оставляешь максимальный логинг всего. Затем все меньше с возможностью включить при необходимости, если что-то долго никак не ловится за хвост :)

ps. также не стоит забывать про... и что пользователям ваш софт может быть глубоко до лампочки :) особенно когда он «мешает работать(спать на работе ;)».
pps. и вообще ошбки не для пользоватлей показываются (по крайней мере часть), а еще для аминов или девелоперов — лучше не забывать. :)
ppps. первый пост без ката — для привлечения"
пользователь заметки шелл утилитки декодирование текст,"Вам когда-нибуть писали nfrjt,? :)


Обычно раздражает. Или по буквам вычитываешь, или просишь написать «нормально». А ведь проще завести себе скриптик (shell или bat — смотря под какой ОС) вида:
tr qwerty… йцукен…


далее его запускаешь и копируешь туда белиберду. На выходе — нормальный текст. :) И мучать(ся) не надо никого.

Рецепт приготовления:
1) скачать «tr» под винду (в unix-ах он и так есть). Например вот такой — UnixUtils for win32 (кто не вкурсе win32 — это так виндовз обзывают ;) или у google спросить «tr.exe win32».
2) в текстовом редакторе (MS Word это не текстовый редактор! ;) набрать файлик вида «tr» пробел, дальше по порядку нажимаете все ангийские буквы, пробел, далее все те же русские буквы (желательно не вводить те что стоят не над английскими, а над кавычками и палочками — чтобы понять текст можно и без этих букв обойтись)
3) сохраняете как «decode.bat» или decode.sh (для unix)
4) запускаете и пользуетесь.

Копировать туда текст под виндами можно нажав на левую-верхнуюю иконку окна.

Ye djj,otv elfxb! :)

ps. т.е програмка делает подстановку в тексте — каждую букву из первого куска меняет на такую же по счету из второго — «q» на «й», «w» на «ц» и т.п Здесь подробнее ;)
"
блог смотритель карма,"А смотрители как-то могут влиять на содержимое своих блогов?

Реальная ситуация:
создал блог, написал туда сообщение по теме (я создал, кому как не мне знать его тему? ;), а тут пришел неизвестно кто (нет списка) и опустил сообщение на 2 вниз — оно исчезло из блога (видимой для всех его части). Мало того что я никак на это не могу повлиять как создавший блог и вроде как смотритель («Создатель блога автоматически назначается смотрителем» — может и ошибаюсь, но он и за правильность наполнения отвечает, а не только за убирание спама), но и просто как-то обидно :(

Если уж не нравится блог как таковой — тогда за него надо целиком голосовать (существовать ему как блогу или нет), а не по одному сообщению топить. Карму блога ввести не как рейтинг, а на тех же принципах что карма человека — со стрелочками куда каждый нажать может.

ps. не буду назвать блог, чтобы не выглядело как реклама :)"
хабрахабр теги,"Хабракоманда хабрахабрила хабрахабрила — и нахабрахабрила. За сегодняшний вечер исправлены некоторые технические недочёты, а главное — теперь разделителем тегов является только запятая. Это значит, что теги, состоящие из двух и более слов, не нужно заключать в кавычки. Всё равно некоторые забывали это делать… )

P.S. Подсказки под полем тегов обязательно поправят."
хабрахабр ошибки метки вёрстка,"Вот здесь

Вглядывался-вглядывался и увидел, что левая часть плашки отличается от правой. В правой в сверху и снизу в углах находятся несколько белых пикселей. И так в ff2/ie6/ie7.
Это дизайнерская замута такая, или всё-таки баг?
В остальных аналогичных плашках в других разделах я такого не нашёл."
habr toolbar,"Возникла идея — почему бы не разработать Хабра_Тулбар наподобие Гугловского и т.д.

Можно также сделать его модулем для Фокса, например, — думаю многие на хабре огнелиса юзают… ;-)

Функционал может быть следующим:
 — написать в свой блог
 — написать в блог по выбору (из списка блогов, в которых участвуешь)
 — просмотреть список последних хабратопиков или комментов через RSS
 — искать по 
* новостям на Хабре
* всем блогам на Хабре 
* подписанным блогам на Хабре
* профилям хабрапользователей
* компаниям
* работе
* другой поиск… ;-)
 — добавить чей-то блог в блогролл на морде личного хабраблога — это немного из будущего, т.к. видимо всё-же на Хабре дадут возможность ведения персонального блога на отдельном поддомене
 — что-то ещё — предлагайте…

Вам бы хотелось такой тулбар?"
хабрахищник,"Я так понимаю, что доводка всяких инструментов по упорядочению и подстройке Хабра продолжается в перманентном режиме. НО:
не заложить ли нам внесистемный компонент с непредсказуемым действием? 
Ну так, для забавы, как говорят всякие прики — «по приколу».
Простейшая идея: Хабрахищник, тайная непроявляемая хабрасущность, которая может так откусить кусок хабракармы у случайного юзера, слопать запись в блоге и так далее — нанести какой-нибудь непредсказуемый символический урон. При этом, конечно, действия этого монстра должны документироваться вроде:

у пользователя Пупкин хабрахищником откушено 3 пункта кармы
Эту идею можно развивать и дальше — например, хабраангел.
Выношу на обсуждение."
хабрахабр дизайн идея предложение idea habrahabrru,Предлагаю в unordered list (тэг ul) заменить чёрные точки напротив каждого пункта на микроизображение логотипа Хабра — так списки будут выглядеть гораздо более стильно и станут лучше соответствовать общему дизайну.
информационная безопасность инфосфера черви эволюция интерне,"Зашел почитать новости на Хабре.
Эволюция в Инфосфере набирает обороты. В одном из своих блогов (не побоюсь назвать этот адрес — на Mail.ru) я уже размышлял о том, что мы являемся свидетелями эволюции в Инфосфере, которая пока идет силами скорее людей, чем машин. Пред-эволюционная стадия… которая уже привела к тому, что сетевые черви борются друг с другом за место под солнцем на серверах.
А теперь прочитал вот что… 

(цит.)… Интересная программа Vigilante создается в кембриджском подразделении MS Research. Эта программа обнаруживает и отвечает на атаки сетевых червей неизвестного типа. Чтобы обнаружить их, в сети расставляются серверы-приманки (honeypots), которые должны быть атакованы червями в первую очередь. На этих серверах идет анализ входящего трафика, а в случае обнаружения новой «заразы» программа информирует об этом специалистов по безопасности.

Итак, в дополнение к бульону протосуществ имеем «зоны наименьшего благоприятствования» (ну, или можно обозвать это мутагенным фактором) в Инфосфере, где плохо приспособленные кодотвари будут вымирать целыми видами. Следующим шагом в развитии я предполагаю появление поколения кодотварей, способных выявлять подобные места в Сети, и перестраивать свой код так, чтобы не ловиться в эти ловушки. Оттуда уже недалеко и до межвидовой координации, и до скрещивания.

Пока у червей основным направлением деятельности является пожирание ресурса (с соответствующими «отходами» в виде спама), и размножение. Но развитие идет…"
хабрахабр работа,"Как ни прискорбно это осознавать, раздел «Вакансии» на Хабре еще очень и очень сырой… А вещь-то хорошая, посему надо улучшать и развивать.

Есть пара предложений:

Разделить вакансии по городам. Не очень-то здорово жителю Петербурга просматривать кучу объявлений о работе в Москве.
Организовать что-то вроде рейтинга вакансий/резюме и добавить возможность добавлять к ним комментарии (тогда вакансия/резюме полностью уподобляется хабратопику и следует светлой вебдванольной идее социального ранжирования, отсеивания недостойных и восхваления лучших, а по сути намного облегчает проблему поиска и выбора :)

"
