tags,texts
хабрахаб wiki FAQ ЧАВО механизм движок,"Привет!

Для сборника ответов на Часто Задаваемые Вопросы мы решили использовать идею wiki, поскольку, как нам кажется, нет смысла писать одному конкретному человеку FAQ для такого сайта, как Хабрахабр. Все равно останутся люди, у которых останутся вопросы.
Посему, обращаюсь к читателям группы со следующим вопросом: какой wiki-движок из доступных, по-вашему, идеально подходит для составления «коллективного» ЧАВО по сайту?
"
ошибки баги bugs error warning,"Кроме неработающих и отсутствующих страниц, о которых мы знаем, есть ошибки о которых мы ничего не знаем. Чем они отличаются? Хм… трудный вопрос. Пишите обо всем, а мы разберемся! =) И ничего не забудем.

Хабрахабр!"
RSS,"Какими службами пользуетесь для чтения RSS-потоков? Почему? В чем плюсы и минусы?

Я остановился на Яндес.Лента. Плюсов масса, минус один — днем, в часы пик, сайт часто «лежит», а если не лежит — долго откликается.
"
Google Маслов Сокур и партнеры PR сопровождение страшилка R,"Насколько я знаю, Google выбрал агентство «Маслов, Сокур и партнеры» для pr-сопровождения в России на местном рынке. Недавно они провели неформальную встречу с журналистами, а сегодня в Ведомостях была опубликована статья-страшилка: «Рамблер должен бояться»."
хабрахабр подкасты mp контент тексты,"Мы планируем добавить в раздел «тексты» возможность публиковать подкасты. Наполнение будет коллективным, как в колонках, с аналогичной системой публикации и трансляции анонсов на первой странице.

Что думаете об этом?

Мне кажется, идея хорошая. Сейчас есть достаточно блоггеров, и просто хороших людей, готовых публиковать подкасты на тему высоких технологий."
логин login,"У меня такое ощущение, что logout время от времени происходит самопроизвольно, несмотря на то, что чекбокс про логине включен.

Возможно, это происходит при смене IP-адреса, но я не уверен."
социальные сети Orkut SIP LiveJournal регионы,"Иногда получается так, что интернет-сервис становится популярен в какой-то аудитории, для которой он вроде бы не создавался. Так получилось с Orkut, которым пользуются в основном латиноамериканцы, c LiveJournal, которым пользуется очень много российских пользователей, с протоколом телефонии SIP, который очень интересует индийцев и т.д.

Интересно, а почему так происходит?

Становились ли русскоязычные ресурсы популярными в одной или нескольких странах экс-СССР?"
удаление,"Ну и может быть редактирование постов?
В принципе совсем не трудно сделать ссылку [удалить] у своих коментариев. Я даже скажу больше… оно уже реализовано… 
Нужно?"
предложение комментарии,Почему бы не сделать пометки у новых комментариев к просмотренной ранее странице? Было бы круто! А то неуютно как-то.
сообщества интернет-сообщество социальные сети нишевой бренд,"Я вот тут подумал, смотря, скажем, на Комби: зачем надо создавать социальную сеть, чтобы потом там формировать сообщества?

Ведь сразу возникает вопрос — откуда деньги? AdSense-like? Для русскоязычной аудитории — сомнительно. Конечно, Бегун может говорить о $1,5, но это — копейки, и меня даже эти цифры смущают…

Единственно жизнеспособным подходом, имхо, является формирование однородного сообщества на отдельном сайте по признаку отношения к некой предметной области, и введение туда существующего (или создание, что — тоже вариант) нишевого бренда.

В этом случае такой подход, во-первых — дешевле, во-вторых — контент контролируется лучше, чем в социальных сетях (почему — это отдельная огромная тема). В третьих — есть такой эффект — если сайт «только про это», то интереса у любителей «этого» он вызывает больше, чем сайт, который «и про это — тоже». В общем — время, конечно, покажет, но логика — великая вещь. :))"
хабрахабр поиск,"Сейчас работат поиск в текстах и профиле пользователя. Поиск в комментариях не работает еще. В группах и блоге тоже.
"
хабрахабр рекомендации рейтинг предпочтения,"Мы планируем транслировать пользовательские рекомендации по следующим категориям сайтов: блоги, СМИ, социальные сети.

Для чего это нужно?
Во-первых, для сбора статистики. Во-вторых, нам интересно строить некий рейтинг пользовательских предпочтений. Вероятно, многим интересно будет узнать, какие блоги и СМИ чаще всего читают пользователи этого сайта, в каких сетях состоят, и так далее.

Мы планируем спрашивать рекомендации по трем категориям сайтов (блоги, СМИ, социальные сети), но список может быть расширен, предлагайте :-) 
"
сообщества социальные сети меркетинг новый маркетинг web ,"Тут мы будем давать примеры миграции первых во вторые и мимикрии первых под вторые.

Пример первый:

blog.it-studio.kiev.ua/?p=295

Образовательная социальная сеть."
блогосфера популярность дневник standalone,"Предлагаю постить ссылки на любимые (читай — ежедневнопосещаемые) standalone-блоги. Прежде всего интересуют блоги на русском, но от английского тоже не стоит отказываться."
Google доменные имена ,"Занятный список: www.pronetadvertising.com/articles/googles-growing-list-of-domains.html
Всего 520 доменов."
хабрахабр ошибки теги,"В русском языке есть только слово «тег» (см. Грамоту.ру, Википедию, Лингво). На Хабре же используется «таг» для обозначения меток и «html-тэги». Может исправите? Или хотя бы только один вариант будете использовать.
"
rss комментарии,"Уже есть? Если есть — где кнопка?
Если нет, будет? Если будет — когда?"
хабрахабр контекстная реклама,Когда доделаете? Какие будут расценки?
хабрахабр комментарии,"А можно на главной странице у новостей, у которых только заголовок выводится, кол-во комментариев сделать ссылкой на комментарии? Будет сильно удобнее."
блог заголовок,"странно, что блог живет своей жизнью, и его заголовки и кол-во каментов не отражаются на главной странице хабрахабра. "
блоггинг журнал жж тематический блог личный блог,"Я уже задавлся этим вопросом для себя. Принял решение в одном блоге делать заметки как на профессиональную тематику, так и личные, за жизнь.

Хотя вот со временем стал понимать, что, с оджной стороны, качественный тематический блог, которые ведет эксперт, набирает со временем авторитет в своей области, с другой стороны, порой хочется написать что-нибудь из серии «посмотрел кино» или «ходили гулять», что бцудет выбиваться из серьезного экспертного стиля блога.

Как быть? Заводить еще один блог, жж? Или есть такая грань популярности, которую нужно перейти и после которой даже твоя заметка «я купил себе диск» будет читаться, комментироваться и ее будут ждать?"
комментарии rss,А может вот такую штуку сделать — в RSS вместе с заголовком новости или поста будет отдаваться в скобках кол-во имеющихся комментариев? А вот если эта цифра будет обновляться при запросе?
хабрахабр трекбеки пингбеки,"Было бы здорово, если бы вы добавили на Хабре возможность принимать трекбеки и пингбеки. Нам, читателям, это позволит узнавать подробности и мнения о новостях в сторннних блогах. Блоггерам — увеличить трафик. А Хабр выиграет, потому что большее кол-во блоггеров станет ссылаться на его новости."
электронная коммерция Владислав Улендеев эффективность трафи,"Чтобы оживить группу, публикую ответ исполнительного директора холдинга eHouse Владислава Улендеева, который не вошел в интервью.

При всей своей мощи eHouse практически не использует трафик с поисковиков, в то время как все остальные интернет-магазины буквально сидят на трафике с "" Яндекс.Маркета"".
Я спросил Владислава, почему eHouse не участвует в Маркете, и вот что он ответил:
Ответ прост. Остальные не умею считать эффективность рекламы на «Яндекс Маркете». Реклама на «Яндексе» не эффективна. И никаких других причин не рекламироваться там нет. Мы умеем считать с точностью до цента эффективность рекламы на каждого посетителя и на каждый источник. Также, вы не правы о том, что мы не рекламируемся на поисковиках. Мы активно рекламируемся на Гугле. С него мы получаем реальных покупателей, а не роботов, которые кликают на ссылке в «Маркете». 
Мы пробовали несколько раз. Но результат работы с «Маркетом» плачевный. И не нужно здесь искать подводных камней. Их нет. Просто дорого и не эффективно.

Итак, насколько верно утверждение, что реклама на «Яндекс.Маркет» не эффективна?"
интернет торговля электронная коммерция интернет магазин Рун,"Несколько коллег пожаловалось на серьезный спад продаж в мае-июне этого года. Один говорил о стагнации, а несколько и вовсе заявили о том, что в этом году дела обстоят даже несколько хуже, чем в прошлом году. Судя по последним данным, аудитория Рунета в этот период существенно уменьшилась, что в принципе и не удивительно, однако такого серьезного спада активности явно никто не ожидал. Какие мысли на этот счет коллеги? Российский е-коммерц начинает сдавать позиции из-за практически повсеместного отвратительного качества обслуживания или просто сезонность, может людям расхотелось покупать онлайн?"
подкастинг mp аудио СМИ журналистика контент медиа,"На этой неделе Хабрахабр откроет в публичный доступ возможность публиковать подкасты. Это совершенно новая вещь, еще не такая распространенная, как блоггинг, например, поэтому, сегодня задался вопросом: как записывать подкасты?

Судя по отзывам, лучшей программой для записи подкастов является Audacity. Это свободный аудиредактор с открытым исходным кодом. Он работает под Mac OS X, Microsoft Windows, GNU/Linux и другими операционными системами.

Возможно, есть другие программы, более удобные, и если кто-то может дать совет — буду признателен, поскольку для меня в подкастинге все только начинается. :)

"
избранное статьи favourities,"Господа с бесконечной кармой. Хотелось бы узнать.
1 — Кнопка Избранное работает? 
2 — Если работает, то где я могу прочитать свои избранные статьи?
3 — Если сервис предполагается сделать не на один день, тогда у меня вопрос, есть ли идеи по поводу того как организовать персональный раздел «Избранное». Я как пользователь могу сказать, мне лично статьи копировать с сайта выглядит уже не интересным, но таковые есть вот пример. Мне интересно обсуждение и сам текст, но у меня вопрос, изначально добавить его в избранное, работает? Могу ли я надеяться на то, что Хабр, будет хранить инфо так же бережно здесь, и могу ли я ссылаться на статью в будущем с указанием, того, что она в моих избранных (!), или же по этой ссылке. Почему я заговорил об избранных, наверняка у вас отслеживаются какие статьи попадают в избранное, и какие из этого можно делать выводы, и мне не вас учить на эту тему. Но как пользователь, банально бы хотел иметь представление, как позже работать со статьями, цитировать и прочее… Тут собрались вроде бы блоггеры и наверняка это будет всем интересно как и проекту, ибо 
внешние ссылки никогда не мешают. 

Плюс: можно сделать папки для избранных статей? А-ля Новотека, да будет привет господину Ашманову отсюда… 

спасибо.
"
brand mapping реклама branding online branding,"Очень интересный проект — mapping. 

Этот носитель придумали недавно, хотя идея лежала на поверхности. Возможно не ошибусь, если скажу, что первым (по крайней мере первыми заметным) примером стал сериал Sopranos

Совместно с maps.google они брендировали карту. Поллучился серчинг по местам преступлений коварных мафиозных кланов Нью-Йорка. Особенно понравилось тем, кто пропустил серии: гугл карта помечена в тех местах, где кого-то убили или обидели. Кликаешь — вылезает пропущенный эпизод в поп-ап окне. 

Вот такой vehicle, можно пытаться применять к местным брендам. А может быть кто-то уже успел? Тогда жду ссылок. Вопрос к специалистам: возможно ли это на нашем рынке или нужна вся мощь Google? "
хабрахабр хабратред почта,"Почему ответы в группах на корневой пост хабратреда не приходят почтой, как ответы в других местах?"
подкастинг любимые рекомендации обсуждение предпочт,"Хотелось бы узнать, ваше предпочтение, узнать, что предпочитаете слушать, что нравится, что нет. Что рекомендуете.

***

Самое простое решение этого вопроса, конечно же сделать скрин шот своего списка подкастов и загрузить его. 
Даже в профиле можно указать ссылку на скриншот своих подкастов. (но это только мысль)

НО! Тогда без текста мы не сможем сделать даже рейтинг популярности подкастов среди пользователей Хабр. Если он конечно нам нужен :) 

"
предложение функциональность общение ответные эмоции резюмир,"1 — Предлагаю сделать функцию как «игнор коммента» или просто функция «означающая молчание» — потому что хочется, что бы человек понял, я прочитал его высказывание и сделал вывод и мой ответ деликатное молчание, или умное молчание в ответ на не адекватные реплики и выпады. Почему смотрим сюда. Буду рад в очень редких случаях такой функцией воспользоваться (надеюсь это будет не очень часто).

2 — И еще, можно ли сделать резюмирование темы или треда (общения?)

Что бы было понятно, что тема закрыта и по результатам, можно было делать резюме из сказанного и желающим ознакомиться с результатом, можно было его в краткой форме почитать, ибо, если интересны детали, каждый всегда может зайти и посмотреть, что там есть интересного.

"
blog группа тред,"Я знал и раньше, а теперь осознал, чем группы на Хабре отличаются от общего блога, при условии, что писать я собираюсь примерно на одну и ту же тему. Только не смейтесь, что я такой салага. Я просто плохой categorizer абстрактных понятий.

В группу я буду сливать все линки, новинки и мысли, которые могут быть интересны только мне и еще паре человек. И ничего, если почти никто не читает — ведь в группу заходят только те, кому это нужно. Если будут читать – отлично! 

А в блог я помещу только то, что интересно всем. Так? Или, хотя бы то, что имеет потенциал заинтересовать, хотя и принадлежит к моей узкой в разрезе хабрахабра теме. Правильно? 

Вот брендинг в интернете — эта тема может быть интересна многим. Но если я хочу обсудить идею или новость в которой не до конца уверен (может это уже год как не новость, а идею уже придумали до меня 8 человек и один робот), то я сливаю эту инфу сюда – только для тех, кто захотел зайти, вдали от строгих взглядов. В общем, вот так. Да?

Тогда ждите новостей. 
"
